Anteeksi, mutta tämä ruoka on kylmää.	Excuse me, but this food is cold.
Pahoittelen, mutta pihvini on aivan raaka.	I'm sorry, but my steak is completely raw.
Tämä kana on valitettavasti ylikypsää ja kuivaa.	This chicken is unfortunately overcooked and dry.
Saisinko puhua tarjoilijan kanssa? Ruoassani on ongelma.	Could I speak to the waiter? There is a problem with my food.
Tämä keitto maistuu palaneelta.	This soup tastes burnt.
En voi syödä tätä, se on aivan liian suolaista.	I can't eat this, it is far too salty.
Olen pahoillani, mutta tämä salaatti on nuutunut.	I'm sorry, but this salad is wilted.
Löysin hiuksen annoksestani.	I found a hair in my dish.
Tämä kala ei maistu tuoreelta.	This fish doesn't taste fresh.
Onko mahdollista saada uusi annos?	Is it possible to get a new dish?
Haluaisin valittaa tästä ruoasta.	I would like to complain about this food.
Maku on todella outo, onko tässä kaikki kunnossa?	The taste is very strange, is everything okay with this?
Perunani ovat kovia ja raakoja sisältä.	My potatoes are hard and raw on the inside.
Kastike on todella mauton.	The sauce is really tasteless.
Tämä ei ole sitä, mitä tilasin.	This is not what I ordered.
Voitteko viedä tämän pois ja poistaa sen laskulta?	Could you take this away and remove it from the bill?
Odotin jotain aivan muuta.	I was expecting something completely different.
Tämä on suuri pettymys.	This is a big disappointment.
Liha on sitkeää kuin kengänpohja.	The meat is as tough as a shoe sole.
Vihannekset ovat ylikypsiä ja mössöisiä.	The vegetables are overcooked and mushy.
Voinko puhua keittiömestarille?	May I speak to the chef?
Annos on jäähtynyt odottaessamme.	The dish has gotten cold while we waited.
Tässä ruoassa on todella erikoinen sivumaku.	This food has a really peculiar aftertaste.
En ole tyytyväinen tähän annokseen.	I am not satisfied with this dish.
Tämä ei vastaa kuvausta ruokalistalla.	This does not match the description on the menu.
Haluaisin lähettää tämän takaisin keittiöön.	I would like to send this back to the kitchen.
Tämä on yksinkertaisesti syömäkelvotonta.	This is simply inedible.
Rasva maistuu vanhalta ja härskiintyneeltä.	The grease tastes old and rancid.
Pastani ui öljyssä.	My pasta is swimming in oil.
Leipä on kuivaa ja vanhan makuista.	The bread is dry and tastes stale.
Haluaisin hyvityksen tästä annoksesta.	I would like a refund for this dish.
Tämä ei ole hintansa arvoinen.	This is not worth the price.
Olen pahoillani, mutta en aio maksaa tästä.	I'm sorry, but I am not going to pay for this.
Miten aiotte korvata tämän?	How are you going to compensate for this?
Ruoan laatu on todella heikko.	The quality of the food is very poor.
Onko tämä pakastettua ja mikrotettua?	Is this frozen and microwaved?
Tämä maistuu puolivalmisteelta.	This tastes like a ready-made meal.
Kala haisee voimakkaasti, ei hyvällä tavalla.	The fish has a strong smell, not in a good way.
Salaatinkastike on pelkkää etikkaa.	The salad dressing is pure vinegar.
Pihvini on sitkeä ja täynnä jänteitä.	My steak is tough and full of gristle.
Tämä ei ole lainkaan sitä, mitä odotin.	This is not at all what I expected.
Voinko tilata jotain muuta tämän tilalle?	Can I order something else instead of this?
Tämä on kolmas kerta, kun olen pettynyt ruokaanne.	This is the third time I've been disappointed with your food.
Annos on paljon pienempi kuin yleensä.	The portion is much smaller than usual.
Ranskalaiset ovat löysiä ja rasvaisia.	The fries are limp and greasy.
Pizzan pohja on palanut mustaksi.	The pizza crust is burnt black.
Juusto maistuu oudolta, onko se mennyt vanhaksi?	The cheese tastes strange, has it gone bad?
En voi uskoa, että tarjoilette tällaista.	I can't believe you serve something like this.
Haluaisin puhua ravintolapäällikön kanssa.	I would like to speak with the restaurant manager.
Tämä on todella epämiellyttävä kokemus.	This is a very unpleasant experience.
Ruoassa on jotain, mille olen allerginen, vaikka pyysin sen pois.	There is something in the food I'm allergic to, even though I asked for it to be left out.
Tämä on alikypsää, melkein vielä jäässä keskeltä.	This is undercooked, it's almost still frozen in the middle.
Miksi tämän annoksen saamisessa kesti niin kauan, jos se on kylmää?	Why did this dish take so long to arrive if it's cold?
Tämä ei ole tuoretta, se on selvästi seissyt pitkään.	This isn't fresh, it has clearly been sitting for a long time.
Tämä on rehellisesti sanottuna aika pahaa.	This is, frankly, quite bad.
Kastikkeessa ei ole mitään makua.	There is no flavour in the sauce whatsoever.
Onko tämä todella teidän normaali laatu?	Is this really your normal standard?
En suosittelisi tätä kenellekään.	I would not recommend this to anyone.
Tämä pilaa koko illallisemme.	This is ruining our whole dinner.
Pihvi on sitkeä, en saa sitä leikattua.	The steak is tough, I can't cut it.
Mausteet puuttuvat kokonaan.	The spices are completely missing.
Tämä on liian tulista, en pysty syömään sitä.	This is too spicy, I am unable to eat it.
Hampurilaispihvi on kuiva ja murenee.	The hamburger patty is dry and crumbly.
Salaatinlehdet ovat ruskeita reunoista.	The lettuce leaves are brown at the edges.
Tämä ei ole kypsennetty kunnolla.	This has not been cooked properly.
En halua korvaavaa annosta, haluan vain, että tämä poistetaan laskusta.	I don't want a replacement dish, I just want this removed from the bill.
Miten keittiössänne voi tapahtua tällainen virhe?	How can a mistake like this happen in your kitchen?
Tämä on pettymys, olimme kuulleet hyvää tästä paikasta.	This is a disappointment, we had heard good things about this place.
Lasagne on kuivaa ja palanut reunoilta.	The lasagna is dry and burnt on the edges.
Riisi on paakkuista ja kovaa.	The rice is lumpy and hard.
Annos näyttää siltä, että se on vain heitetty lautaselle.	The dish looks like it was just thrown on the plate.
Tämä ei ole syötävää.	This is not edible.
Olen pahoillani, mutta tämä on todella ala-arvoista.	I'm sorry, but this is really substandard.
Kalani on täynnä ruotoja.	My fish is full of bones.
En usko, että tämä on sitä, mitä ruokalistalla luvattiin.	I don't think this is what was promised on the menu.
Tämä maistuu teolliselta.	This tastes industrial.
Voiko kokki maistaa tätä itse?	Could the chef taste this themselves?
Olen erittäin pettynyt tähän ruokaan.	I am extremely disappointed with this food.
Tämä ei ole tuoretta pastaa.	This is not fresh pasta.
Vihannekset ovat selvästi pakasteesta.	The vegetables are clearly from the freezer.
Tämä ei ole lähelläkään sitä, mitä tilasin.	This isn't even close to what I ordered.
Ette voi olettaa minun maksavan tästä.	You can't expect me to pay for this.
Olen sanaton, miten huonoa tämä on.	I'm speechless at how bad this is.
Tämä on ensimmäinen kerta, kun olen joutunut lähettämään ruokaa takaisin.	This is the first time I've ever had to send food back.
Miten tämä pääsi edes keittiöstä ulos?	How did this even get out of the kitchen?
Tämä on suorastaan loukkaus.	This is frankly an insult.
Maku on tunkkainen.	The taste is musty.
Liha on rasvaista ja huonolaatuista.	The meat is fatty and of poor quality.
Tämä ei ole kypsynyt tarpeeksi kauan.	This has not been cooked for long enough.
Tämä on palanut pinnalta ja raaka sisältä.	This is burnt on the outside and raw on the inside.
Onko teillä uusi kokki?	Do you have a new chef?
Tämän piti olla päivän erikoinen, mutta se on kamala.	This was supposed to be the special of the day, but it's terrible.
Tämä ei ole lainkaan raikas.	This is not fresh at all.
Haluaisin vain maksaa juomat ja lähteä.	I would just like to pay for the drinks and leave.
Tämä kokemus on pilannut ruokahaluni.	This experience has ruined my appetite.
En tule tänne enää koskaan syömään.	I will never eat here again.
Tämä ei ole syömäkelpoista ihmisravinnoksi.	This is not fit for human consumption.
Pahoittelen, mutta minun on oltava rehellinen tästä.	I'm sorry, but I have to be honest about this.
Olen todella pettynyt palvelun ja ruoan laatuun.	I am really disappointed in the quality of the service and the food.
